{
  "accepted_signal_definitions": 0,
  "capture_summary": {
    "gateways": 1,
    "listen_only_records": 5176,
    "records": 5176,
    "sessions": 8,
    "unique_identifiers": 17
  },
  "contract": "can.signal-hypothesis-evaluation",
  "contract_version": "1.0.0",
  "display_policy": {
    "allowed_surface": "ENGINEERING_RESEARCH",
    "blocked_surfaces": [
      "OWNER_HEALTH",
      "MAINTENANCE_DECISION",
      "FINDING",
      "RECOMMENDATION",
      "AUTOMATIC_BASELINE"
    ],
    "required_badge": "UNVERIFIED CROSS-MODEL HYPOTHESIS",
    "statement": "Candidate transforms expose what published cross-model mappings would produce on the retained target bytes. Plausible values, correlations, and source agreement do not establish exact 2005 4Runner semantics or permit promotion."
  },
  "hypothesis_evaluations": [
    {
      "candidate_semantic": "engine.speed",
      "field_values": {
        "count": 659,
        "maximum": 5660.0,
        "mean": 1436.714719,
        "minimum": 0.0,
        "standard_deviation": 652.965048
      },
      "hypothesis_id": "toyota.2c4.engine-speed.be16",
      "hypothesis_status": "HIGH_PRIORITY_CROSS_MODEL_CANDIDATE",
      "identifier": 708,
      "identifier_hex": "0x2C4",
      "limitations": "The identifier and byte field recur in Toyota research, but no authoritative exact-vehicle source has established the 2005 4Runner scaling.",
      "production_value_display_allowed": false,
      "records": 659,
      "sessions": 8,
      "target_evidence_status": "FIELD_PRESENT_DYNAMIC",
      "transform_evaluations": [
        {
          "source_ids": [
            "realdash-fj-cruiser-cedfdf49",
            "aim-community-dbc-6e2f88f",
            "aim-community-auris-6e2f88f",
            "aim-community-lexus-is-f-6e2f88f"
          ],
          "summary": {
            "count": 659,
            "maximum": 4421.875,
            "mean": 1122.433374,
            "minimum": 0.0,
            "standard_deviation": 510.128944
          },
          "transform_id": "toyota-rpm-x0p78125",
          "unit": "rpm"
        }
      ]
    },
    {
      "candidate_semantic": "engine.intake-air-temperature",
      "field_values": {
        "count": 659,
        "maximum": 50.0,
        "mean": 34.631259,
        "minimum": 30.0,
        "standard_deviation": 5.017329
      },
      "hypothesis_id": "toyota.2c4.intake-air-temperature.byte3",
      "hypothesis_status": "CROSS_MODEL_CANDIDATE",
      "identifier": 708,
      "identifier_hex": "0x2C4",
      "limitations": "Two related-platform community sources associate the candidate byte with intake-air temperature but disagree on scale and offset. The apparently plausible target range is not semantic proof.",
      "production_value_display_allowed": false,
      "records": 659,
      "sessions": 8,
      "target_evidence_status": "FIELD_PRESENT_DYNAMIC",
      "transform_evaluations": [
        {
          "source_ids": [
            "realdash-fj-cruiser-cedfdf49"
          ],
          "summary": {
            "count": 659,
            "maximum": 50.0,
            "mean": 34.631259,
            "minimum": 30.0,
            "standard_deviation": 5.017329
          },
          "transform_id": "fj-intake-air-temperature-raw-degc",
          "unit": "degC"
        },
        {
          "source_ids": [
            "aim-community-lexus-is-f-6e2f88f"
          ],
          "summary": {
            "count": 659,
            "maximum": 85.0,
            "mean": 46.578149,
            "minimum": 35.0,
            "standard_deviation": 12.543323
          },
          "transform_id": "lexus-is-f-intake-air-temperature-x2p5-minus40-degc",
          "unit": "degC"
        }
      ]
    },
    {
      "candidate_semantic": "transmission.turbine-speed",
      "field_values": {
        "count": 626,
        "maximum": 11339.0,
        "mean": 2856.022364,
        "minimum": 0.0,
        "standard_deviation": 1317.202949
      },
      "hypothesis_id": "toyota.2d0.turbine-speed.be16",
      "hypothesis_status": "CROSS_MODEL_CANDIDATE",
      "identifier": 720,
      "identifier_hex": "0x2D0",
      "limitations": "CSU left this identifier unknown on a 2010 Camry. The NFI Lexus study found RPM-related data in 0x2D0 but did not establish the FJ turbine interpretation or scale, which still come from one later related-platform community mapping.",
      "production_value_display_allowed": false,
      "records": 626,
      "sessions": 8,
      "target_evidence_status": "FIELD_PRESENT_DYNAMIC",
      "transform_evaluations": [
        {
          "source_ids": [
            "realdash-fj-cruiser-cedfdf49"
          ],
          "summary": {
            "count": 626,
            "maximum": 4429.296875,
            "mean": 1115.633736,
            "minimum": 0.0,
            "standard_deviation": 514.532402
          },
          "transform_id": "fj-turbine-rpm-x0p390625",
          "unit": "rpm"
        }
      ]
    },
    {
      "candidate_semantic": "transmission.selector-code",
      "field_values": {
        "count": 626,
        "maximum": 8.0,
        "mean": 7.833866,
        "minimum": 0.0,
        "standard_deviation": 1.140821
      },
      "hypothesis_id": "toyota.2d0.selector-code.byte2",
      "hypothesis_status": "CROSS_MODEL_CANDIDATE",
      "identifier": 720,
      "identifier_hex": "0x2D0",
      "limitations": "The target capture contains only a small unlabeled code set and cannot establish which state any code represents. The NFI Lexus paper places current gear in its fifth byte position, while the FJ artifact places a selector candidate in its third byte position; the conflict blocks cross-model field promotion.",
      "production_value_display_allowed": false,
      "records": 626,
      "sessions": 8,
      "target_evidence_status": "FIELD_PRESENT_DYNAMIC",
      "transform_evaluations": [
        {
          "source_ids": [
            "realdash-fj-cruiser-cedfdf49"
          ],
          "summary": {
            "count": 626,
            "maximum": 8.0,
            "mean": 7.833866,
            "minimum": 0.0,
            "standard_deviation": 1.140821
          },
          "transform_id": "fj-selector-enum-code",
          "unit": "enum_code"
        }
      ]
    },
    {
      "candidate_semantic": "engine.accelerator-pedal-position",
      "field_values": {
        "count": 631,
        "maximum": 95.0,
        "mean": 1.992076,
        "minimum": 0.0,
        "standard_deviation": 10.72262
      },
      "hypothesis_id": "toyota.2c1.accelerator-pedal.byte6",
      "hypothesis_status": "HIGH_PRIORITY_CROSS_MODEL_CANDIDATE",
      "identifier": 705,
      "identifier_hex": "0x2C1",
      "limitations": "The CSU Camry and NFI Lexus experiments independently support pedal-related behavior at this byte position, but the current target captures are unlabeled, so range and activity cannot prove that driver pedal movement caused the field or that the cross-model scale applies.",
      "production_value_display_allowed": false,
      "records": 631,
      "sessions": 8,
      "target_evidence_status": "FIELD_PRESENT_DYNAMIC",
      "transform_evaluations": [
        {
          "source_ids": [
            "realdash-fj-cruiser-cedfdf49",
            "comma-opendbc-b4ef5e1",
            "aim-community-auris-6e2f88f",
            "aim-community-lexus-is-f-6e2f88f"
          ],
          "summary": {
            "count": 631,
            "maximum": 47.5,
            "mean": 0.996038,
            "minimum": 0.0,
            "standard_deviation": 5.36131
          },
          "transform_id": "fj-pedal-x0p5-percent",
          "unit": "percent"
        }
      ]
    },
    {
      "candidate_semantic": "steering.wheel-angle",
      "field_values": {
        "count": 667,
        "maximum": 39.0,
        "mean": 33.46027,
        "minimum": -12.0,
        "standard_deviation": 13.592136
      },
      "hypothesis_id": "toyota.025.steering-angle.signed12",
      "hypothesis_status": "HIGH_PRIORITY_CROSS_MODEL_CANDIDATE",
      "identifier": 37,
      "identifier_hex": "0x025",
      "limitations": "Sources agree strongly on the steering semantic family but not a universal layout: the pinned 2009 iQ definition is signed 11-bit at 1 degree/count, Prius and generated Toyota definitions are signed 12-bit at 1.5 degrees/count, and the FJ formula uses a very different scale and direction. No target degree value is accepted.",
      "production_value_display_allowed": false,
      "records": 667,
      "sessions": 8,
      "target_evidence_status": "FIELD_PRESENT_DYNAMIC",
      "transform_evaluations": [
        {
          "source_ids": [
            "comma-opendbc-b4ef5e1"
          ],
          "summary": {
            "count": 667,
            "maximum": 58.5,
            "mean": 50.190405,
            "minimum": -18.0,
            "standard_deviation": 20.388205
          },
          "transform_id": "opendbc-toyota-signed12-x1p5-deg",
          "unit": "deg"
        },
        {
          "source_ids": [
            "realdash-fj-cruiser-cedfdf49"
          ],
          "summary": {
            "count": 667,
            "maximum": 1.054688,
            "mean": -2.940844,
            "minimum": -3.427734,
            "standard_deviation": 1.194621
          },
          "transform_id": "fj-signed12-xneg0p087890625-deg",
          "unit": "deg"
        }
      ]
    },
    {
      "candidate_semantic": "brakes.pedal-pressure",
      "field_values": {
        "count": 143,
        "maximum": 0.0,
        "mean": 0.0,
        "minimum": 0.0,
        "standard_deviation": 0.0
      },
      "hypothesis_id": "toyota.224.brake-pressure.be16-low9",
      "hypothesis_status": "CROSS_MODEL_CANDIDATE",
      "identifier": 548,
      "identifier_hex": "0x224",